{
  "schemaVersion": 1,
  "providerId": "notes",
  "requestId": "fixture-inbox",
  "operation": "inbox",
  "context": {
    "scope": "account",
    "accountId": "11111111-1111-4111-8111-111111111111",
    "workspaceId": null,
    "grantRevision": "notes-grant-1",
    "translationId": null
  },
  "privacy": "private",
  "coverage": "cloud-snapshot",
  "status": "ready",
  "observedAt": "2026-10-01T08:00:00.000Z",
  "expiresAt": "2026-10-01T08:02:00.000Z",
  "sourceUpdatedAt": "2026-10-01T08:00:00.000Z",
  "data": {
    "items": [
      {
        "issueId": "issue-example",
        "dedupeKey": "note-sync-example",
        "title": "Example sync conflict",
        "type": "sync-conflict",
        "severity": "important",
        "state": "open",
        "attention": "unread",
        "updatedAt": "2026-10-01T08:00:00.000Z",
        "expiresAt": null,
        "actionKey": "open"
      }
    ]
  }
}
